{
  "kind": "CGKNAdaptiveIteration",
  "schema_version": "1.0",
  "iteration_id": "ITER-049",
  "project_id": "cgkn",
  "goal": "Establish CGKN Codex Edition as the separately named Codex-and-tools branch distribution with a dedicated launcher and runtime identity while preserving the CGKN kernel and formal Provider delivery route.",
  "backlog_item_ids": [
    "PB-039"
  ],
  "workflow_state": "closed",
  "evidence_status": "PASS",
  "acceptance_criteria": [
    "Edition runtime and supervisor state use generated/cgkn_editions/codex and .cgkn/editions/codex.",
    "README, edition documentation, kernel documentation, registry, and runtime baseline use the edition identity consistently.",
    "Static checks, kernel guards, supervisor tests, and documentation consistency checks pass.",
    "The active branch is codex/cgkn-codex-edition.",
    "The branch distribution is named CGKN Codex Edition while formal schemas and kernel identity remain CGKN.",
    "The primary launcher is scripts/start_cgkn_codex_edition.ps1 and the superseded launcher name is removed."
  ],
  "quality_metrics": [
    {
      "id": "QM-CONTRACT",
      "measure": "management artifacts conform to registered JSON schemas and semantic invariants",
      "target": "all management, iteration, and experience artifacts validate",
      "method": "jsonschema tests plus deterministic manager validation"
    },
    {
      "id": "QM-INTEGRATION",
      "measure": "formal provider and delivery route preservation",
      "target": "kernel and provider contract tests pass without a new generation or delivery path",
      "method": "existing kernel and formal provider test profiles"
    },
    {
      "id": "QM-REGRESSION",
      "measure": "changed management capability tests",
      "target": "all targeted tests pass",
      "method": "pytest targeted profile"
    },
    {
      "id": "QM-CODEX-SUPERVISOR",
      "measure": "bounded Codex escalation usefulness and authority isolation",
      "target": "a librarian-curated request and Codex response stay within configured budgets, preserve request identity, produce actionable guidance, and cannot assert formal evidence or delivery authority",
      "method": "schema validation, deterministic contract tests, support-pipeline prompt tests, and an offline failed-generation replay"
    }
  ],
  "quality_activities": {
    "prevention": [
      "Confirm acceptance, interfaces, and applicable kernel constraints before implementation."
    ],
    "assurance": [
      "Review method, schema, skill, and repository instruction consistency.",
      "Validate that support artifacts cannot authorize formal delivery PASS.",
      "Review changed files against the kernel contract before integration."
    ],
    "control": [
      "Run schema and semantic validation.",
      "Run project-management unit tests.",
      "Run skill validation.",
      "Run targeted kernel and knowledge tests."
    ],
    "improvement": [
      "Record review findings and one bounded improvement experiment."
    ]
  },
  "interface_expectations": [
    "The branch name resolves exactly to codex/cgkn-codex-edition.",
    "README.md and EDITION.md present CGKN Codex Edition as the distribution name and preserve CGKN as the formal kernel namespace.",
    "scripts/start_cgkn_codex_edition.ps1 starts scripts.cgkn_runtime_supervisor with API generation, one persistent supervisor, and edition-specific state paths.",
    "scripts/start_cgkn_codex_supervised.ps1 is absent so operators see one canonical Codex-edition launcher.",
    "The kernel guard binds the edition launcher and rejects a reintroduced mixed one-shot Codex path."
  ],
  "evidence_refs": [
    "project_management/cgkn/iterations/ITER-049_RUNTIME_EVIDENCE.md"
  ],
  "review": {
    "outcome": "accepted",
    "feedback": [
      "CGKN Codex Edition now has a dedicated branch identity, canonical launcher, isolated runtime paths, and consistent operator documentation without changing the formal CGKN Provider delivery mainline."
    ],
    "accepted_backlog_item_ids": [
      "PB-039"
    ]
  },
  "retrospective": {
    "worked": [
      "Treating the name as a branch distribution label preserved the formal CGKN kernel and schema contracts while giving the Codex toolset a clear product identity."
    ],
    "did_not_work": [
      "The prior Codex-supervised profile label described a mode but did not identify a separately maintained distribution or branch."
    ],
    "experiments": [
      "After the existing working tree is reviewed and committed, publish the branch and run one private-chat supervisor smoke from the edition launcher."
    ]
  }
}
